vocab,pattern_name,english,japanese
選ぶ,〜を選ぶ,場所を選ぶ,to choose a place
選ぶ,〜を選ぶ,物を選ぶ,to choose an object
選ぶ,〜を選ぶ,道を選ぶ,to choose a path
選ぶ,〜で選ぶ,デザインで選ぶ,to choose based on design
選ぶ,〜で選ぶ,くじで選ぶ,to choose with a lottery
選ぶ,〜で選ぶ,自分で選ぶ,to choose by oneself
感じる,〜を感じる,ストレスを感じる,to feel stress
感じる,〜を感じる,やりがいを感じる,"to feel like something is worthwhile, to feel motivated"
感じる,〜を感じる,不安を感じる,to feel uneasiness
感じる,〜に感じる,身近に感じる,to feel familiar
感じる,〜に感じる,リアルに感じる,to feel real
感じる,〜に感じる,不安に感じる,to feel uneasy
戦う,〜で戦う,力で戦う,to fight with force
戦う,〜で戦う,戦場で戦う,to fight on the battlefield
戦う,〜で戦う,世界で戦う,to compete on a global scale
戦う,〜と戦う,病気と戦う,to fight an illness
戦う,〜と戦う,世界と戦う,"to fight against the world, to compete with the world"
戦う,〜と戦う,モンスターと戦う,to fight a monster
戦う,〜に戦う,代わりに戦う,to fight on behalf of someone else
戦う,〜に戦う,いっしょに戦う,to fight together
戦う,〜に戦う,必死に戦う,to fight desperately
養う,〜で養う,自分で養う,to raise by oneself
養う,〜で養う,皆で養う,"to all raise someone together, to cultivate something all together"
養う,〜で養う,お金で養う,to support financially
養う,〜を養う,力を養う,"to develop one's strength, to cultivate one's ability"
養う,〜を養う,目を養う,to cultivate one's eye for something
養う,〜を養う,家族を養う,to support one's family
受かる,〜に受かる,大学に受かる,to get into university
受かる,〜に受かる,試験に受かる,to pass an exam
受かる,〜に受かる,高校に受かる,to get into high school
疲れる,〜に疲れる,待つことに疲れる,to be tired of waiting
疲れる,〜に疲れる,考えるのに疲れる,to get tired of thinking
疲れる,〜に疲れる,仕事に疲れる,to be tired from work
疲れる,て Form〜,疲れている,to be tired
疲れる,て Form〜,疲れてしまう,to become tired
疲れる,て Form〜,疲れてくる,to start feeling tired
疲れる,〜が疲れる,目が疲れる,eyes get tired
疲れる,〜が疲れる,体が疲れる,body gets tired
疲れる,〜が疲れる,心が疲れる,mind gets tired
疲れる,〜が疲れる,足が疲れる,"legs get tired, feet get tired"
温める,〜で温める,電子レンジで温める,to heat up in a microwave
温める,〜で温める,湯船で温める,to warm oneself in a bathtub
温める,〜で温める,湯せんで温める,to warm something in a vessel placed in hot water
温める,〜を温める,食事を温める,"to heat up a meal, to reheat a meal"
温める,〜を温める,アイディアを温める,to incubate an idea
温める,〜を温める,体を温める,to warm up one's body
手伝う,〜も手伝う,家事も手伝う,to also help out with housework
手伝う,〜も手伝う,私も手伝う,I will help too
手伝う,〜も手伝う,仕事も手伝う,to also help someone with their work
手伝う,〜を手伝う,仕事を手伝う,to help someone with their work
手伝う,〜を手伝う,家事を手伝う,to help out with housework
手伝う,〜を手伝う,作業を手伝う,to help someone with a task
想像する,〜を想像する,自分を想像する,to imagine oneself
想像する,〜を想像する,楽しいことを想像する,to imagine something fun
想像する,〜を想像する,気持ちを想像する,to imagine someone's feelings
想像する,〜に想像する,リアルに想像する,to imagine something realistically
想像する,〜に想像する,勝手に想像する,"to imagine something of one's own accord, to imagine something as one pleases"
想像する,〜に想像する,自由に想像する,to imagine something freely
殺す,〜を殺す,虫を殺す,to kill an insect
殺す,〜を殺す,人を殺す,to kill a person
殺す,〜を殺す,ウイルスを殺す,to kill a virus
殺す,〜が殺す,王が殺す,the king kills
殺す,〜が殺す,私が殺す,I kill
殺す,〜が殺す,人が殺す,someone kills
注文する,〜で注文する,電話で注文する,to order over the phone
注文する,〜で注文する,店で注文する,to order at the store
注文する,〜で注文する,ネットで注文する,to order on the Internet
注文する,〜を注文する,ビールを注文する,to order a beer
注文する,〜を注文する,飲み物を注文する,to order a drink
注文する,〜を注文する,コーヒーを注文する,to order a coffee
注文する,〜に注文する,いっしょに注文する,to order together
注文する,〜に注文する,勝手に注文する,"to order without permission, to order as one pleases"
注文する,〜に注文する,店に注文する,to order from a store
話題,話題が〜,話題がかわる,the topic of conversation changes
話題,話題が〜,話題がない,to not have anything to talk about
話題,話題が〜,話題が出る,a topic of conversation comes up
話題,話題と〜,話題となる,to become a topic of conversation
話題,話題と〜,話題とする,to make something the topic of conversation
話題,話題と〜,話題とからめる,to link something with the topic at hand
話題,話題に〜,話題に上る,to come up as a topic of conversation
話題,話題に〜,話題になる,to become a topic of conversation
話題,話題に〜,話題にする,to make into a topic of conversation
話題,話題を〜,話題をかえる,to change the topic of conversation
話題,話題を〜,話題をよぶ,to attract public attention
話題,話題を〜,話題を集める,to be a major topic of conversation
別れる,〜別れる,すぐ別れる,"will break up immediately, will break up soon"
別れる,〜別れる,もう別れる,"will break up soon, will part ways soon"
別れる,〜別れる,さっぱり別れる,to break up completely
別れる,〜に別れる,二つに別れる,to split in two
別れる,〜に別れる,グループに別れる,to separate into groups
別れる,〜に別れる,きれいに別れる,to have a clean breakup
別れる,〜と別れる,家族と別れる,to part with one's family
別れる,〜と別れる,仲間と別れる,to part with one's friends
別れる,〜と別れる,友人と別れる,to part with a friend
共有する,〜で共有する,クラウドで共有する,to share in the cloud
共有する,〜で共有する,リアルタイムで共有する,to share in real-time
共有する,〜で共有する,皆で共有する,to share with everyone
共有する,〜と共有する,皆さんと共有する,to share with everyone
共有する,〜と共有する,人と共有する,to share with others
共有する,〜と共有する,仲間と共有する,to share with one's peers
共有する,〜を共有する,データを共有する,to share data
共有する,〜を共有する,思いを共有する,"to have an idea in common, to experience something together"
共有する,〜を共有する,時間を共有する,to spend time together
共有する,〜に共有する,リアルタイムに共有する,to share in real-time
共有する,〜に共有する,いっしょに共有する,to share together
共有する,〜に共有する,メンバーに共有する,to share with members
共有する,〜が共有する,スタッフが共有する,the staff shares something
共有する,〜が共有する,社員が共有する,the employees share something
共有する,〜が共有する,全員が共有する,everyone shares something
駅員,駅員に〜,駅員にたずねる,to ask a train station employee
駅員,駅員に〜,駅員に聞く,to ask a train station employee
駅員,駅員に〜,駅員に言う,to say to a train station employee
駅員,駅員が〜,駅員が立つ,the train station employee stands somewhere
駅員,駅員が〜,駅員が来る,the train station employee comes
駅員,駅員が〜,駅員がくれる,the train station employee gives
駅員,駅員〜,駅員たち,train station employees
駅員,駅員〜,駅員室,train station staff room
駅員,駅員〜,駅員さん,train station employee
天王星,天王星の〜,天王星の自転,the rotation of Uranus
天王星,天王星の〜,天王星の運動,the movement of Uranus
天王星,天王星の〜,天王星の発見,the discovery of Uranus
天王星,天王星が〜,天王星が発見される,Uranus is discovered
天王星,天王星が〜,天王星が見える,can see Uranus
天王星,天王星が〜,天王星がある,there is Uranus
俺たち,俺たちは〜,俺たちはやりたい,we want to do it
俺たち,俺たちは〜,俺たちはできる,we can do it
俺たち,俺たちは〜,俺たちはやめとく,we'll pass
俺たち,俺たちの〜,俺たちの先生,our teacher
俺たち,俺たちの〜,俺たちのたまり場,our hangout spot
俺たち,俺たちの〜,俺たちの学校,our school
俺たち,俺たちが〜,俺たちがやる,we'll do it
俺たち,俺たちが〜,俺たちがする,we'll do it
