vocab,pattern_name,english,japanese
感想,〜の感想,人の感想,people's impressions
感想,〜の感想,自分の感想,one's own impression
感想,〜の感想,本の感想,impressions of a book
感想,感想を〜,感想を持つ,"to have an opinion, to have thoughts"
感想,感想を〜,感想を聞く,"to ask someone for their impression, to listen to someone's impression"
感想,感想を〜,感想をいただく,to receive feedback
感想,ご感想,ご感想,"your impressions, your thoughts"
旅館,旅館の〜,旅館の主人,proprietor of the Japanese inn
旅館,旅館の〜,旅館の一階,first floor of the Japanese inn
旅館,旅館の〜,旅館の部屋,room in a Japanese inn
旅館,旅館に〜,旅館に着く,to arrive at the Japanese inn
旅館,旅館に〜,旅館に行く,to go to a Japanese inn
旅館,旅館に〜,旅館にもどる,to return to the Japanese inn
神風,神風が〜,神風が味方する,the divine winds are on our side
神風,神風が〜,神風がふく,divine winds blow
神風,神風が〜,神風が起こる,a divine wind occurs
王様,王様に〜,王様に言う,to say to the king
王様,王様に〜,王様になる,to become a king
王様,王様に〜,王様に会う,to meet the king
王様,王様の〜,王様の耳,the ears of a king
王様,王様の〜,王様の命令,the king's order
王様,王様の〜,王様の息子,the king's son
王様,王様は〜,王様はやさしい,the king is kind
王様,王様は〜,王様は大きい,the king is large
王様,王様は〜,王様はえらい,the king is admirable
王様,王様が〜,王様がする,the king does
王様,王様が〜,王様が言う,the king says
王様,王様が〜,王様がいる,there is a king
王様,〜の王様,国の王様,a country's king
王様,〜の王様,はだかの王様,the naked king (from The Emperor's New Clothes)
王様,〜の王様,カニの王様,king crab (Alaskan or Japanese)
左利き,左利き〜,左利き用,for left-handed people
左利き,左利き〜,左利き選手,left-handed athlete
左利き,左利き〜,左利きプレーヤー,left-handed player
左利き,左利きの〜,左利きの人,left-handed person
左利き,左利きの〜,左利きの子,left-handed child
左利き,左利きの〜,左利きのグローブ,left-handed glove (sports)
小指,〜の小指,足の小指,pinky toe
小指,〜の小指,左手の小指,little finger of the left hand
小指,〜の小指,右手の小指,little finger of the right hand
小指,小指の〜,小指の下,underneath the little finger
小指,小指の〜,小指の付け根,base of the little finger
小指,小指の〜,小指の先,tip of the little finger
小指,小指を〜,小指をぶつける,to knock one's little finger against something
小指,小指を〜,小指を使う,to use one's little finger
小指,小指を〜,小指を立てる,to raise one's little finger
宿,宿の〜,宿の近く,near the inn
宿,宿の〜,宿の主人,innkeeper
宿,宿の〜,宿の前,in front of the inn
宿,宿に〜,宿に着く,to reach the inn
宿,宿に〜,宿に入る,"to enter the inn, to stay at an inn"
宿,宿に〜,宿にもどる,to return to the inn
暗記,暗記〜,暗記カード,flash card
暗記,暗記〜,暗記力,ability to memorize things
暗記,暗記〜,暗記科目,class requiring considerable memorization
暗記,暗記を〜,暗記を行う,to perform memorization
暗記,暗記を〜,暗記を始める,to begin memorizing
暗記,暗記を〜,暗記をする,to memorize
暗記,〜暗記,全部暗記,memorize entirely
暗記,〜暗記,全て暗記,memorize all
暗記,〜暗記,丸暗記,"rote memorization, indiscriminately learning by heart"
水銀,水銀を〜,水銀を使う,to utilize mercury
水銀,水銀を〜,水銀をふくむ,to contain mercury
水銀,水銀を〜,水銀を用いる,to utilize mercury
中指,中指を〜,中指を曲げる,to bend one's middle finger
中指,中指を〜,中指を立てる,to raise one's middle finger
中指,中指を〜,中指を使う,to use one's middle finger
中指,中指の〜,中指の付け根,base of the middle finger
中指,中指の〜,中指の先,tip of the middle finger
中指,中指の〜,中指の下,"below the middle finger, underneath the middle finger"
鏡,鏡を〜,鏡を見る,to look at a mirror
鏡,鏡を〜,鏡を持つ,"to hold a mirror, to have a mirror"
鏡,鏡を〜,鏡を使う,to use a mirror
鏡,鏡に〜,鏡に当たる,to strike a mirror (light)
鏡,鏡に〜,鏡にうつる,to be reflected in a mirror
鏡,鏡に〜,鏡にうつす,to reflect in a mirror
映画館,〜の映画館,昔の映画館,"a movie theater from long ago, an old movie theater"
映画館,〜の映画館,近くの映画館,a nearby movie theater
映画館,〜の映画館,地元の映画館,a local movie theater
映画館,〜映画館,小さい映画館,a small movie theater
映画館,〜映画館,大きい映画館,a large movie theater
映画館,〜映画館,古い映画館,an old movie theater
映画館,映画館に〜,映画館に行く,to go to the movie theater
映画館,映画館に〜,映画館に来る,to come to the movie theater
映画館,映画館に〜,映画館にいる,to be at the movie theater
映画館,映画館で〜,映画館でデートする,to have a date at the movie theater
映画館,映画館で〜,映画館で待ち合わせする,to meet at the movie theater
映画館,映画館で〜,映画館で見る,to see at the movie theater
殺人,殺人〜,殺人者,murderer
殺人,殺人〜,殺人命令,an order to kill someone
殺人,殺人〜,殺人映画,murder film
殺人,殺人を〜,殺人を行う,to commit a murder
殺人,殺人を〜,殺人をする,to commit a murder
殺人,殺人を〜,殺人を実行する,to carry out a murder
楽器,楽器を〜,楽器を使う,to use a musical instrument
楽器,楽器を〜,楽器を持つ,to hold a musical instrument
楽器,楽器を〜,楽器を鳴らす,to play an instrument
楽器,楽器の〜,楽器の練習,musical instrument practice
楽器,楽器の〜,楽器の音色,an instrument's tone
楽器,楽器の〜,楽器の音,the sound of a musical instrument
楽器,楽器が〜,楽器ができる,"can play an instrument, a musical instrument is made"
楽器,楽器が〜,楽器がある,there is an instrument
楽器,楽器が〜,楽器が鳴る,the musical instrument makes a sound
当然,当然〜,当然知っている,"common sense, of course one knows something"
当然,当然〜,当然ある,"something is naturally there, of course there is something"
当然,当然〜,当然考える,"a natural consideration, would naturally think about something"
自然,自然に〜,自然に親しむ,"to commune with nature, to naturally become friendly with"
自然,自然に〜,自然に出る,to come out naturally
自然,自然に〜,自然にできる,can naturally do
自然,自然の〜,自然のめぐみ,the blessings of nature
自然,自然の〜,自然の力,the power of nature
自然,自然の〜,自然の流れ,the natural sequence of events
自然,自然〜,自然科学,natural sciences
自然,自然〜,自然発生,"a natural occurrence, abiogenesis"
自然,自然〜,自然界,the natural world
一億,一億 + unit,一億ドル,one hundred million dollars
一億,一億 + unit,一億円,one hundred million yen
一億,一億 + unit,一億ユーロ,one hundred million euros
一億円,一億円を〜,一億円をもらう,to receive one hundred million yen
一億円,一億円を〜,一億円を見つける,to find one hundred million yen
一億円,一億円を〜,一億円を失う,to lose one hundred million yen
情熱,情熱が〜,情熱が感じられる,can feel someone's enthusiasm
情熱,情熱が〜,情熱がある,to have passion for something
情熱,情熱が〜,情熱が伝わる,someone's passion comes through
情熱,情熱を〜,情熱を感じる,"to feel passionate about something, to feel someone's else's passion for something"
情熱,情熱を〜,情熱を注ぐ,to pour one's passion into something
情熱,情熱を〜,情熱を持つ,to be passionate about something
体育,体育〜,体育祭,sports day
体育,体育〜,体育大学,sports university
体育,体育〜,体育大会,athletic meet
体育,体育を〜,体育をする,to do PE class
体育,体育を〜,体育を見学する,to observe PE class
体育,体育を〜,体育を教える,to teach PE
体育,体育の〜,体育の時間,PE time
体育,体育の〜,体育の先生,PE teacher
体育,体育の〜,体育の授業,PE class
情け,情けが〜,情けがある,to have compassion
情け,情けが〜,情けがない,"to lack compassion, to have no heart"
情け,情けが〜,情けがわく,"pity wells up, sympathy wells up"
情け,情けを〜,情けを持つ,to have compassion
情け,情けを〜,情けをかける,"to take pity on someone, to show compassion for someone"
情け,情けを〜,情けを知る,"to fall in love for the first time, to learn the depths of human tenderness"
詩,詩の〜,詩の意味,the poem's meaning
詩,詩の〜,詩の世界,the world of poetry
詩,詩の〜,詩の形,the form of a poem
詩,詩を〜,詩を見る,to look at a poem
詩,詩を〜,詩を作る,to create a poem
詩,詩を〜,詩を読む,"to read a poem, to recite a poem"
詩人,詩人の〜,詩人の名前,name of a poet
詩人,詩人の〜,詩人の心,the heart of a poet
詩人,詩人の〜,詩人の言葉,the words of a poet
詩歌,詩歌を〜,詩歌を読む,to read poetry
詩歌,詩歌を〜,詩歌を学ぶ,to learn poetry
詩歌,詩歌を〜,詩歌を作る,to write poetry
詩歌,詩歌の〜,詩歌のリズム,the rhythm of poetry
詩歌,詩歌の〜,詩歌の世界,the world of poetry
詩歌,詩歌の〜,詩歌の作者,the creator of poetry
練習,〜練習,発音練習,pronunciation practice
練習,〜練習,発声練習,"voice training, vocal exercises"
練習,〜練習,合同練習,"combined practice, practicing in a group"
練習,練習を〜,練習を始める,to begin practice
練習,練習を〜,練習を行う,to conduct practice
練習,練習を〜,練習をする,to practice
練習,〜の練習,日々の練習,daily practice
練習,〜の練習,会話の練習,conversation practice
練習,〜の練習,ふだんの練習,regular practice
選手,選手が〜,選手がする,the pro athlete does
選手,選手が〜,選手が集まる,the pro athletes gather
選手,選手が〜,選手がいる,there is an athlete
選手,選手に〜,選手になれる,can become a pro athlete
選手,選手に〜,選手に選ばれる,to be chosen as a pro athlete
選手,選手に〜,選手になる,to become a pro athlete
選手,選手の〜,選手の皆さん,all the pro athletes
選手,選手の〜,選手の名前,name of the pro athlete
選手,選手の〜,選手の言葉,the words of the pro athlete
選手,選手を〜,選手を目指す,to aim to be a pro athlete
選手,選手を〜,選手を見る,to see a pro athlete
選手,選手を〜,選手を育てる,to train a pro athlete
問題,〜の問題,自分の問題,one's own problem
問題,〜の問題,最大の問題,the biggest problem
問題,〜の問題,心の問題,matter of the heart
問題,問題を〜,問題を考える,to think about a problem
問題,問題を〜,問題を出す,to give out a problem
問題,問題を〜,問題を見る,to see a problem
問題,問題が〜,問題がある,there is a problem
問題,問題が〜,問題が生じる,a problem occurs
問題,問題が〜,問題が発生する,a problem arises
実感,実感が〜,実感が持てる,can have a real sense of something
実感,実感が〜,実感がある,to have a solid sense of something
実感,実感が〜,実感がわく,the realization bubbles up in one's mind
実感,実感を〜,実感を感じる,to experience a realization
実感,実感を〜,実感を持つ,to have a real sense of something
実感,実感を〜,実感を持てる,can have a real sense of something
大好き,〜が大好き,花ちゃんが大好き,to really like Hana-chan
大好き,〜が大好き,あなたが大好き,I really like you
大好き,〜が大好き,仕事が大好き,to really like work
大好き,大好きな〜,大好きな人,a person one really likes
大好き,大好きな〜,大好きな物,a favorite thing
大好き,大好きな〜,大好きな事,a favorite thing
大好き,大好きに〜,大好きになる,"to come to really like something, to come to really like someone"
大好き,大好きに〜,大好きになれる,"can come to really like something, can come to really like someone"
大好き,大好きに〜,大好きに感じる,to feel like one really likes something
回想,回想〜,回想中,while reminiscing
回想,回想〜,回想文,"written reminiscences, memoirs"
回想,回想〜,回想シーン,a flashback (film)
回想,回想に〜,回想にふける,"to indulge in reminiscences, to be lost in retrospection"
回想,回想に〜,回想に入る,"to enter into reminiscences, to enter into a flashback (film)"
回想,回想に〜,回想になる,to become a recollection
回想,回想を〜,回想を聞く,to listen to reminiscences
回想,回想を〜,回想をする,to reminisce
回想,回想を〜,回想を交える,to mix in reminiscences in a narrative
右利き,右利き〜,右利き用,for right handed people
右利き,右利き〜,右利き選手,right handed athlete
右利き,右利き〜,右利き社会,society made for right handed people
右利き,右利きの〜,右利きの選手,right handed athlete
右利き,右利きの〜,右利きの人間,right handed person
右利き,右利きの〜,右利きの人,right handed person
輪,輪に〜,輪に入れる,"to include in a group, to put through a hoop"
輪,輪に〜,輪になる,to form a loop
輪,輪に〜,輪に入る,"to join a group, to pass through a hoop"
輪,〜の輪,光の輪,a ring of light
輪,〜の輪,人の輪,a circle of people
輪,〜の輪,仲間の輪,a circle of friends
輪,輪が〜,輪ができる,a circle is formed
輪,輪が〜,輪がある,"there is a circle, there is a loop"
輪,輪が〜,輪が広がる,the circle spreads out
輪,輪を〜,輪をかく,to draw a loop
輪,輪を〜,輪を作る,to make a loop
輪,輪を〜,輪を広げる,to spread out the circle
学問,学問の〜,学問の世界,the academic world
学問,学問の〜,学問の道,"the academic path, the path of learning"
学問,学問の〜,学問の自由,academic freedom
学問,学問を〜,学問をする,to pursue one's studies
学問,学問を〜,学問を教える,"to teach scholarly knowledge, to teach higher education"
学問,学問を〜,学問を学ぶ,to study a discipline
課長,課長が〜,課長がおっしゃる,the section manager says
課長,課長が〜,課長が行う,the section manager does
課長,課長が〜,課長がいる,there is a section manager
課長,課長に〜,課長に言う,to say to the section manager
課長,課長に〜,課長になる,to become a section manager
課長,課長に〜,課長に聞く,to ask the section manager
彼女,〜の彼女,私の彼女,my girlfriend
彼女,〜の彼女,僕の彼女,my girlfriend
彼女,〜の彼女,俺の彼女,my girlfriend
彼女,彼女の〜,彼女のお母さん,her mother
彼女,彼女の〜,彼女の年,her age
彼女,彼女の〜,彼女の電話番号,her phone number
彼女,彼女は〜,彼女はかわいい,she is cute
彼女,彼女は〜,彼女はオシャレ	,she is fashionable
彼女,彼女は〜,彼女は明るい,she is cheerful
彼女,彼女が〜,彼女がいる,to have a girlfriend
彼女,彼女が〜,彼女ができる,to get a girlfriend
彼女,彼女と〜,彼女とデートする,to go on a date with one’s girlfriend
彼女,彼女と〜,彼女とあそぶ,to hang out with one’s girlfriend
彼女,彼女に〜,彼女にあげる,to give one’s girlfriend something
彼女,彼女に〜,彼女にフラれる,to be dumped by one’s girlfriend
新宿,新宿に〜,新宿にいる,to be in Shinjuku
新宿,新宿に〜,新宿にある,to be in Shinjuku
新宿,新宿に〜,新宿に行く,to go to Shinjuku
銀,銀を〜,銀を使う,to use silver
銀,銀を〜,銀を買う,to buy silver
銀,銀を〜,銀を入れる,"to put in silver, to insert silver"
銀,銀の〜,銀のスプーン,silver spoon
銀,銀の〜,銀のさじ,silver spoon
銀,銀の〜,銀のナイフ,silver knife
銀色,銀色に〜,銀色になる,to turn silver
銀色,銀色に〜,銀色に光る,to shine silver
銀色,銀色に〜,銀色にかがやく,to sparkle silver
銀色,銀色の〜,銀色の部分,the silver colored part
銀色,銀色の〜,銀色の光,silver light
銀色,銀色の〜,銀色のナメクジ,silver slug
特選,特選〜,特選ギフト,gift for those specially selected
特選,特選〜,特選記事,specially featured article
特選,特選〜,特選和牛,specially selected Wagyu
特選,特選に〜,特選に入る,to be specially selected
特選,特選に〜,特選に入選する,"to be selected for a high honor, to be awarded a prize"
特選,特選に〜,特選に選ばれる,"to be selected for a high honor, to be awarded a prize"
駅,駅に〜,駅に着く,to arrive at a station
駅,駅に〜,駅にある,to be at the station
駅,駅に〜,駅にいる,to be at the station
駅,駅で〜,駅で待つ,to wait at a station
駅,駅で〜,駅で下車する,to get off at a station
駅,駅で〜,駅でおりる,to get off at a station
駅,〜の駅,地下鉄の駅,subway station
駅,〜の駅,次の駅,the next station
駅,〜の駅,道の駅,a roadside rest area
駅,駅の〜,駅の売店,station kiosk
駅,駅の〜,駅の近く,near the station
駅,駅の〜,駅のホーム,station platform
駅長,駅長が〜,駅長がいる,there is a station master
駅長,駅長が〜,駅長が行う,the station master performs
駅長,駅長が〜,駅長が開ける,the station master opens something
駅長,駅長に〜,駅長に会える,can meet the station master
駅長,駅長に〜,駅長に会う,to meet the station master
駅長,駅長に〜,駅長になる,to become the station master
駅長,駅長の〜,駅長のすがた,the figure of the station master
駅長,駅長の〜,駅長の気分,"the station master's mood, the station master's feelings"
駅長,駅長の〜,駅長のぼうし,the station master's hat
駅長,駅長〜,駅長さん,station master
駅長,駅長〜,駅長室,station master's office
駅長,駅長〜,駅長たち,the station masters
自殺,自殺の〜,自殺のニュース,news of suicide
自殺,自殺の〜,自殺の名所,a place well-known for suicides
自殺,自殺の〜,自殺のリスク,suicide risk
自殺,自殺を〜,自殺を試みる,to attempt suicide
自殺,自殺を〜,自殺を考える,to think of suicide
自殺,自殺を〜,自殺をする,to commit suicide
力士,力士が〜,力士がいる,there is a sumo wrestler
力士,力士が〜,力士がする,the sumo wrestler does something
力士,力士が〜,力士が勝つ,the sumo wrestler wins
力士,力士に〜,力士に勝つ,to win against a sumo wrestler
力士,力士に〜,力士に伝える,to tell a sumo wrestler
力士,力士に〜,力士になる,to become a sumo wrestler
同感,同感を〜,同感を感じる,to feel sympathy
同感,同感を〜,同感を求める,to seek agreement
同感,同感を〜,同感を持つ,to have the same sentiment
食器,食器の〜,食器の音,the sound of tableware
食器,食器の〜,食器のよごれ,dirty spots on the tableware
食器,食器の〜,食器の後かたづけ,clearing the tableware after a meal
食器,食器を〜,食器を選ぶ,to choose tableware
食器,食器を〜,食器をならべる,to line up the tableware
食器,食器を〜,食器を用意する,to prepare tableware
食器,〜の食器,自分の食器,one's own tableware
食器,〜の食器,プラスチックの食器,plastic tableware
食器,〜の食器,他の食器,other tableware
田代島,田代島に〜,田代島にある,to be on Tashirojima
田代島,田代島に〜,田代島にいる,to be on Tashirojima
田代島,田代島に〜,田代島に行く,to go to Tashirojima
感謝,感謝の〜,感謝の気持ち,feelings of thanks
感謝,感謝の〜,感謝の言葉,words of gratitude
感謝,感謝の〜,感謝の心,"a thankful heart, gratitude"
感謝,感謝を〜,感謝を伝える,to convey one's thanks
感謝,感謝を〜,感謝をする,to give thanks
感謝,感謝を〜,感謝を申し上げる,to humbly give thanks
五感,五感で〜,五感で感じる,to feel with all five senses
五感,五感で〜,五感で味わう,to savor with all five senses
五感,五感で〜,五感で楽しむ,to enjoy with all five senses
五感,五感を〜,五感を働かせる,to put all five senses to work
五感,五感を〜,五感を活用する,to make use of all five senses
五感,五感を〜,五感を使う,to use all five senses
親指,親指の〜,親指の先,the tip of one's thumb
親指,親指の〜,親指のツメ,thumbnail
親指,親指の〜,親指の付け根,base of the thumb
親指,親指で〜,親指でおさえる,to hold down with one's thumb
親指,親指で〜,親指でおす,to press with one's thumb
親指,親指で〜,親指ではじく,to flip with one's thumb
親指,親指を〜,親指を当てる,to place one's thumb on something
親指,親指を〜,親指を使う,to use one's thumb
親指,親指を〜,親指を立てる,"to raise one's thumb, to give a thumbs up"
親指,〜の親指,左手の親指,left thumb
親指,〜の親指,右手の親指,right thumb
親指,〜の親指,足の親指,big toe
車輪,車輪の〜,車輪の下,underneath the car wheel
車輪,車輪の〜,車輪の回転,the turn of a car wheel
車輪,車輪の〜,車輪のあと,tire tracks
車輪,車輪を〜,車輪を外す,to remove a tire
車輪,車輪を〜,車輪を付ける,to attach a tire
車輪,車輪を〜,車輪を回す,to turn the car wheels
車輪,車輪が〜,車輪が回転する,the tire revolves
車輪,車輪が〜,車輪が回る,the car wheel turns
車輪,車輪が〜,車輪が付く,"to come with tires, the tire attaches to something"
疲れ,お疲れ,お疲れ,"good work (set phrase), fatigue (honorific)"
疲れ,疲れが〜,疲れがとれる,fatigue is relieved
疲れ,疲れが〜,疲れがたまる,fatigue accumulates
疲れ,疲れが〜,疲れがとれない,unable to shake off fatigue
疲れ,疲れが〜,疲れが出る,"fatigue sets in, fatigue shows"
疲れ,疲れを〜,疲れを知らない,to be tireless
疲れ,疲れを〜,疲れをとる,to get rid of fatigue
疲れ,疲れを〜,疲れを感じる,to feel tired
疲れ,疲れを〜,疲れをいやす,to relieve fatigue
謝る,〜に謝る,先に謝る,to apologize first
謝る,〜に謝る,必死に謝る,to apologize desperately
謝る,〜に謝る,人に謝る,to apologize to someone
謝る,〜が謝る,親が謝る,a parent apologizes
謝る,〜が謝る,私が謝る,I apologize
謝る,〜が謝る,相手が謝る,the other party apologizes
着く,〜に着く,東京に着く,to arrive in Tokyo
着く,〜に着く,ホテルに着く,to arrive at a hotel
着く,〜に着く,家に着く,to arrive at home
空く,〜が空く,時間が空く,to have free time
空く,〜が空く,テーブルが空く,a table becomes available
空く,〜が空く,グラスが空く,a glass becomes empty
空く,Past Form + Noun,空いた時間,free time
空く,Past Form + Noun,空いたスペース,available space
空く,Past Form + Noun,空いたグラス,an empty glass
感動する,〜感動する,とても感動する,"to be very moved by something, to be very impressed by something"
感動する,〜感動する,ちょっと感動する,"to be a little touched by something, to be a little impressed by something"
感動する,〜感動する,本当に感動する,"to really be moved by something, to really be impressed by something"
感動する,〜に感動する,言葉に感動する,"to be moved by someone's words, to be impressed by someone's words"
感動する,〜に感動する,生き方に感動する,"to be moved by someone's way of living, to be impressed by someone's way of living"
感動する,〜に感動する,話に感動する,"to be moved by a story, to be impressed by a story"
育てる,〜を育てる,力を育てる,"to cultivate one's strength, to cultivate one's ability"
育てる,〜を育てる,心を育てる,to nurture one's heart
育てる,〜を育てる,人を育てる,"to raise someone, to train someone"
育てる,〜で育てる,自分で育てる,to raise by oneself
育てる,〜で育てる,ベランダで育てる,to grow on the veranda
育てる,〜で育てる,みんなで育てる,to raise together with everyone
育てる,〜に育てる,大事に育てる,to raise with great care
育てる,〜に育てる,大切に育てる,to raise lovingly with care
育てる,〜に育てる,いっしょに育てる,to raise together
追い付く,〜に追い付く,中国に追い付く,to catch up to China
追い付く,〜に追い付く,同点に追い付く,"to catch up to tie the score, to equalize the score"
追い付く,〜に追い付く,日本に追い付く,to catch up to Japan
追いかける,〜を追いかける,車を追いかける,to chase after a car
追いかける,〜を追いかける,ボールを追いかける,to run after a ball
追いかける,〜を追いかける,人を追いかける,to chase after a person
追いかける,〜に追いかける,やみくもに追いかける,to pursue blindly
追いかける,〜に追いかける,いっしょに追いかける,to chase together
追いかける,〜に追いかける,必死に追いかける,to desperately chase after
選ぶ,〜に選ぶ,自由に選ぶ,to choose freely
選ぶ,〜に選ぶ,代表に選ぶ,to choose as a representative
選ぶ,〜に選ぶ,ランダムに選ぶ,to choose randomly
